<?xml version="1.0" encoding="UTF-8"?>
<!DOCTYPE film SYSTEM "film.dtd">
<film>
    <title boxSet="No" id="DVD2" year="2006" time="194">The Holiday</title>
    <DVDCoverDetails width="10" height="10" DVDCoverDesign="The Holiday.jpg"/>
    <description>The Holiday is a 2006 American romantic comedy film distributed by Columbia Pictures in the US and Universal Studios outside the US, starring Cameron Diaz, Kate Winslet, Jude Law, and Jack Black. The story involves two strangers who agree to swap homes temporarily</description>
    <director>
        <firstname>Nancy</firstname>
        <surname>Meyers</surname>
    </director>
    <actress>
        <firstname>Kate</firstname>
        <surname>Winslet</surname>
    </actress>
    <character>Iris</character>
    <actress>
        <firstname>Cameron</firstname>
        <surname>Diaz</surname>
    </actress>
    <character>Amanda</character>
    <actor>
        <firstname>Jude</firstname>
        <surname>Law</surname>
    </actor>
    <character>Graham Simpkins</character>
    <actor>
        <firstname>Jack</firstname>
        <surname>Black</surname>
    </actor>
    <character>Miles Dumont </character>
</film>
    