<?xml version="1.0" encoding="UTF-8"?>
<!DOCTYPE film SYSTEM "film.dtd">
<film>
    <title boxSet="No" id="DVD1" year="1995" time="122">Sabrina</title>
    <DVDCoverDetails width="10" height="10" DVDCoverDesign="Sabrina.jpg"/>    
    <description>Sabrina is a 1995 romantic comedy film adapted by Barbara Benedek and David Rayfiel, based on the 1954 screenplay of the same name, which in turn was based upon a play entitled Sabrina Fair.
        It was directed by Sydney Pollack, and stars Harrison Ford as Linus Larrabee, Julia Ormond as Sabrina and Greg Kinnear (in his first starring film role) as David Larrabee. It also features Angie Dickinson, Richard Crenna, Nancy Marchand, Lauren Holly, John Wood, Dana Ivey and French actress Fanny Ardant.
    </description>
    <director>
        <firstname>Sydney</firstname>
        <surname>Pollack</surname>
    </director>
    <actress>
        <firstname>Julia</firstname>
        <surname>Ormond</surname>
    </actress>
    <character>Sabrina</character>
    <actor>
        <firstname>Harrison</firstname>
        <surname>Ford</surname>
    </actor>
    <character>Linus Larrabee</character>
    <actor>
        <firstname>Greg</firstname>
        <surname>Kinnear</surname>
    </actor>
    <character>David Larrabee</character>
</film>